<?xml version="1.0" ?>
<?xml-stylesheet type="text/xsl" href="familytree.xsl"?>
<!DOCTYPE familytree SYSTEM "familytree.dtd">
<familytree>
    <person pid="p0" forename="Opa" surname="Mustermann" sex="M" birthDate="1920-04-04"
            deathDate="2013-06-07">
        <inlaw pid="p7" forename="Oma" surname="Mustermann" sex="F" birthDate="" deathDate=""/>
        <person pid="p8" forename="Papa" surname="Mustermann" sex="M" birthDate="" deathDate="">
            <inlaw pid="p9" forename="Mama" surname="Mustermann" sex="F" birthDate="" deathDate=""/>
            <person pid="p10" forename="Daniel" surname="Brown" sex="M" birthDate="1994-09-27" deathDate=""/>
            <person pid="p2" forename="Micha" surname="Piertzik" sex="M" birthDate="1996-01-09" deathDate=""/>
            <person pid="p3" forename="Chiara" surname="Armbruster" birthDate="1996-04-29" sex="F" deathDate=""/>
            <person pid="p12" forename="Sarah" surname="Bauert" sex="F" birthDate="1995-09-23" deathDate=""/>
            <person pid="p4" forename="Schwester" surname="Mustermann" sex="F" birthDate="" deathDate="">
                <inlaw pid="p11" forename="Schwager" surname="Anders" sex="M" birthDate="" deathDate=""/>
                <person pid="p5" forename="Neffe" surname="Mustermann" sex="M" birthDate="" deathDate=""/>
                <person pid="p6" forename="Nichte" surname="Mustermann" sex="F" birthDate="" deathDate=""/>
            </person>
        </person>
    </person>
</familytree>
